Quote, Book
There was no possibility of taking a walk that day. We had been wandering, indeed, in the leafless shrubbery an hour in the morning; but since dinner (Mrs. Reed, when there was no company, dined early) the cold winter wind had brought with it clouds so sombre, and a rain so penetrating, that further out-door exercise was now out of the question, Jane Eyre
Until I feared I would lose it, I never loved to read. One does not love breathing, To Kill a Mockingbird
Mockingbirds don't do one thing except make music for us to enjoy. They don't eat up people's gardens, don't nest in corn cribs, they don't do one thing but sing their hearts out for us. That's why it's a sin to kill a mockingbird, To Kill a Mockingbird
The said Eliza, John, and Georgiana were now clustered round their mama in the drawing-room: she lay reclined on a sofa by the fireside, and with her darlings about her (for the time neither quarrelling nor crying) looked perfectly happy. Me, she had dispensed from joining the group; saying, She regretted to be under the necessity of keeping me at a distance; but that until she heard from Bessie, and could discover by her own observation, that I was endeavouring in good earnest to acquire a more sociable and childlike disposition, a more attractive and sprightly manner something lighter, franker, more natural, as it were she really must exclude me from privileges intended only for contented, happy, little children, Jane Eyre
Tom said to himself that it was not such a hollow world, after all. He had discovered a great law of human action, without knowing it namely, that in order to make a man or a boy covet a thing, it is only necessary to make the thing difficult to attain, The Adventures of Tom Saywer